<?xml version="1.0" encoding="UTF-8"?>
<AttributeReleasePolicy xmlns:xsi="http://www.w3.org/2001/XMLSchema-instance" xsi:noNamespaceSchemaLocation="ARP.xsd">
	<Description>Simplest possible ARP.</Description>
	<Rule>
		<Description>Example Rule Description.</Description>
		<Target>
			<AnyTarget/>
		</Target>
		<Attribute name="urn:mace:eduPerson:1.0:eduPersonAffiliation">
			<AnyValue release="permit"/>
		</Attribute>
	</Rule>
</AttributeReleasePolicy>